{"schema_version":1,"name":"real_day_2026-07-21_15m_anonymized","source_date":"2026-07-21","timezone":"Europe/Berlin","cadence_minutes":15,"slots":96,"battery_capacity_kwh":24.3,"battery_efficiency":0.95,"initial_soc_pct":44.0,"final_soc_pct":49.82,"actual_pv_kwh":43.62,"actual_load_kwh":11.96,"actual_grid_import_kwh":0.07,"actual_grid_export_kwh":29.87,"actual_battery_charge_kwh":6.22,"actual_battery_discharge_kwh":4.27,"forecast_scale_observed":0.831,"forecast_total_kwh":52.491,"evopt_timeline_kind":"synthetic_actions_on_real_measurements","privacy":"Raw filenames, entity IDs, addresses, tokens, serial numbers and account data were not included.","columns":["slot","time","minute","pv_w","home_w","grid_import_w","grid_export_w","battery_charge_w","battery_discharge_w","soc_pct","pv_actual_cumulative_kwh","pv_forecast_total_kwh","pv_forecast_remaining_kwh","pv_forecast_tomorrow_kwh","evopt_action","evopt_healthy","energy_balance_residual_w"],"rows":[[0,"00:00",0,0,350,0,0,0,350,43.805,0.0,52.491,52.491,31.943,"normal",true,0],[1,"00:15",15,0,270,10,0,0,250,43.437,0.0,52.491,52.491,31.943,"normal",true,-10],[2,"00:30",30,0,260,0,0,0,260,43.09,0.0,52.491,52.491,31.943,"normal",true,0],[3,"00:45",45,0,280,10,0,0,270,42.744,0.0,52.491,52.491,31.943,"normal",true,0],[4,"01:00",60,0,320,0,0,0,320,42.376,0.0,52.491,52.491,31.943,"normal",true,0],[5,"01:15",75,0,270,10,0,0,260,42.007,0.0,52.491,52.491,31.943,"normal",true,0],[6,"01:30",90,0,300,0,0,0,300,41.639,0.0,52.491,52.491,31.943,"normal",true,0],[7,"01:45",105,0,340,10,0,0,330,41.228,0.0,52.491,52.491,31.943,"normal",true,0],[8,"02:00",120,0,300,10,0,0,290,40.816,0.0,52.491,52.491,31.943,"normal",true,0],[9,"02:15",135,0,320,10,0,0,320,40.426,0.0,52.491,52.491,31.943,"normal",true,10],[10,"02:30",150,0,270,0,0,0,260,40.101,0.0,52.491,52.491,31.943,"normal",true,-10],[11,"02:45",165,0,240,0,0,0,230,39.82,0.0,52.491,52.491,31.943,"normal",true,-10],[12,"03:00",180,0,230,0,0,0,230,39.517,0.0,52.491,52.491,31.943,"normal",true,0],[13,"03:15",195,0,230,0,0,0,230,39.192,0.0,52.491,52.491,31.943,"normal",true,0],[14,"03:30",210,0,320,10,0,0,300,38.802,0.0,52.491,52.491,31.943,"normal",true,-10],[15,"03:45",225,0,360,10,0,0,360,38.347,0.0,52.491,52.491,31.943,"normal",true,10],[16,"04:00",240,0,340,10,0,0,330,37.914,0.0,52.491,52.491,31.943,"normal",true,0],[17,"04:15",255,0,220,0,0,0,220,37.567,0.0,52.491,52.491,31.943,"normal",true,0],[18,"04:30",270,0,230,10,0,0,220,37.264,0.0,52.491,52.491,31.943,"normal",true,0],[19,"04:45",285,0,310,10,0,0,300,36.917,0.0,52.491,52.491,31.943,"normal",true,0],[20,"05:00",300,0,280,0,0,0,280,36.549,0.0,52.491,52.491,31.943,"normal",true,0],[21,"05:15",315,0,240,10,0,0,240,36.224,0.0,52.491,52.491,31.943,"normal",true,10],[22,"05:30",330,0,200,10,0,0,200,35.943,0.0,52.491,52.491,31.943,"normal",true,10],[23,"05:45",345,30,230,10,0,0,190,35.683,0.0,52.491,52.491,31.943,"normal",true,0],[24,"06:00",360,110,350,0,0,0,240,35.401,0.01,52.491,52.479,31.943,"holdcharge",true,0],[25,"06:15",375,200,240,10,30,0,60,35.163,0.05,52.491,52.431,31.943,"holdcharge",true,0],[26,"06:30",390,300,150,0,170,0,10,35.033,0.11,52.491,52.359,31.943,"holdcharge",true,-10],[27,"06:45",405,370,140,0,250,0,10,34.947,0.19,52.491,52.262,31.943,"holdcharge",true,-10],[28,"07:00",420,500,140,0,370,0,10,34.86,0.3,52.491,52.13,31.943,"holdcharge",true,0],[29,"07:15",435,580,200,0,400,0,10,34.773,0.43,52.491,51.974,31.943,"holdcharge",true,-10],[30,"07:30",450,720,230,0,500,0,10,34.687,0.6,52.491,51.769,31.943,"holdcharge",true,0],[31,"07:45",465,950,140,0,830,0,10,34.6,0.83,52.491,51.492,31.943,"holdcharge",true,-10],[32,"08:00",480,1230,480,0,760,0,0,34.535,1.14,52.491,51.119,31.943,"holdcharge",true,-10],[33,"08:15",495,1270,450,0,830,0,0,34.513,1.47,52.491,50.722,31.943,"holdcharge",true,-10],[34,"08:30",510,1340,400,0,940,0,0,34.513,1.82,52.491,50.301,31.943,"holdcharge",true,0],[35,"08:45",525,2430,430,0,2000,0,0,34.513,2.49,52.491,49.495,31.943,"holdcharge",true,0],[36,"09:00",540,4790,250,0,4540,0,0,34.513,3.64,52.491,48.111,31.943,"normal",true,0],[37,"09:15",555,4880,340,0,4540,0,0,34.513,4.91,52.491,46.582,31.943,"normal",true,0],[38,"09:30",570,5160,360,0,4800,0,0,34.513,6.22,52.491,45.006,31.943,"normal",true,0],[39,"09:45",585,5210,420,0,4790,0,0,34.513,7.58,52.491,43.369,31.943,"normal",true,0],[40,"10:00",600,5420,860,0,4560,0,0,34.513,8.98,52.491,41.685,31.943,"normal",true,0],[41,"10:15",615,5580,930,0,4650,0,0,34.513,10.42,52.491,39.952,31.943,"normal",true,0],[42,"10:30",630,5650,910,0,4740,0,0,34.513,11.87,52.491,38.207,31.943,"normal",true,0],[43,"10:45",645,5980,850,0,5130,0,0,34.513,13.4,52.491,36.366,31.943,"normal",true,0],[44,"11:00",660,6200,880,0,5320,0,0,34.513,15.01,52.491,34.428,31.943,"normal",true,0],[45,"11:15",675,6700,930,0,5760,0,0,34.513,16.75,52.491,32.335,31.943,"normal",true,10],[46,"11:30",690,5520,1620,0,3900,0,0,34.533,18.26,52.491,30.517,31.943,"normal",true,0],[47,"11:45",705,5630,600,0,4460,570,0,35.217,19.46,52.491,29.073,31.943,"normal",true,0],[48,"12:00",720,5530,410,0,1790,3330,0,36.918,20.73,52.491,27.545,31.943,"charge",true,0],[49,"12:15",735,1670,530,10,750,390,0,38.13,21.16,52.491,27.028,31.943,"charge",true,10],[50,"12:30",750,4470,550,20,1770,2170,0,38.97,22.19,52.491,25.788,31.943,"charge",true,0],[51,"12:45",765,5800,440,0,2020,3330,0,40.71,23.59,52.491,24.103,31.943,"charge",true,10],[52,"13:00",780,3540,340,0,1920,1280,0,42.254,24.33,52.491,23.213,31.943,"normal",true,0],[53,"13:15",795,3210,490,180,0,2900,0,43.876,25.27,52.491,22.082,31.943,"normal",true,0],[54,"13:30",810,2380,470,20,10,1910,0,46.164,26.11,52.491,21.071,31.943,"normal",true,10],[55,"13:45",825,5770,460,0,1520,3790,0,49.057,27.53,52.491,19.362,31.943,"normal",true,0],[56,"14:00",840,1630,400,0,10,1220,0,51.519,28.03,52.491,18.761,31.943,"normal",true,0],[57,"14:15",855,4630,530,220,1000,3330,0,53.376,28.88,52.491,17.738,31.943,"normal",true,-10],[58,"14:30",870,3670,540,0,860,2270,0,55.761,29.92,52.491,16.486,31.943,"normal",true,0],[59,"14:45",885,5110,480,0,2960,1670,0,57.677,31.36,52.491,14.753,31.943,"normal",true,0],[60,"15:00",900,900,370,0,290,240,0,58.42,31.66,52.491,14.392,31.943,"normal",true,0],[61,"15:15",915,1050,390,0,660,0,0,58.498,32.22,52.491,13.718,31.943,"normal",true,0],[62,"15:30",930,6750,390,0,6360,0,0,58.517,33.95,52.491,11.637,31.943,"normal",true,0],[63,"15:45",945,6970,420,0,6540,10,0,58.517,35.74,52.491,9.483,31.943,"normal",true,0],[64,"16:00",960,5290,460,0,4780,50,0,58.517,37.07,52.491,7.882,31.943,"normal",true,0],[65,"16:15",975,760,400,10,0,360,0,58.635,37.25,52.491,7.665,31.943,"normal",true,10],[66,"16:30",990,2410,450,0,1880,90,0,58.791,37.74,52.491,7.076,31.943,"normal",true,-10],[67,"16:45",1005,2710,500,0,2210,0,0,58.83,38.42,52.491,6.258,31.943,"normal",true,0],[68,"17:00",1020,2010,450,0,1570,0,0,58.83,38.91,52.491,5.668,31.943,"discharge",true,-10],[69,"17:15",1035,3360,410,0,2950,0,0,58.83,39.92,52.491,4.452,31.943,"discharge",true,0],[70,"17:30",1050,4260,370,0,3880,0,0,58.83,40.9,52.491,3.273,31.943,"discharge",true,10],[71,"17:45",1065,2610,410,0,2210,0,0,58.83,41.56,52.491,2.479,31.943,"discharge",true,-10],[72,"18:00",1080,3220,680,0,2540,0,0,58.83,42.38,52.491,1.492,31.943,"hold",true,0],[73,"18:15",1095,1380,980,50,600,0,150,58.7,42.76,52.491,1.035,31.943,"hold",true,0],[74,"18:30",1110,850,910,0,20,0,80,58.484,43.01,52.491,0.734,31.943,"hold",true,0],[75,"18:45",1125,770,520,0,250,0,0,58.375,43.21,52.491,0.493,31.943,"hold",true,0],[76,"19:00",1140,640,510,0,130,0,0,58.354,43.38,52.491,0.289,31.943,"normal",true,0],[77,"19:15",1155,500,480,10,70,0,40,58.31,43.5,52.491,0.144,31.943,"normal",true,0],[78,"19:30",1170,250,450,10,0,0,190,58.115,43.55,52.491,0.084,31.943,"normal",true,0],[79,"19:45",1185,110,400,0,0,0,290,57.769,43.56,52.491,0.072,31.943,"normal",true,0],[80,"20:00",1200,110,400,0,10,0,300,57.379,43.57,52.491,0.06,31.943,"normal",true,0],[81,"20:15",1215,140,390,10,20,0,260,57.032,43.6,52.491,0.024,31.943,"unavailable",false,0],[82,"20:30",1230,150,450,10,0,0,300,56.664,43.62,52.491,0.0,31.943,"unavailable",false,10],[83,"20:45",1245,10,510,10,0,0,490,56.144,43.62,52.491,0.0,31.943,"normal",true,0],[84,"21:00",1260,0,540,10,0,0,530,55.516,43.62,52.491,0.0,31.943,"normal",true,0],[85,"21:15",1275,0,520,10,0,0,510,54.888,43.62,52.491,0.0,31.943,"normal",true,0],[86,"21:30",1290,0,640,50,0,0,590,54.238,43.62,52.491,0.0,31.943,"normal",true,0],[87,"21:45",1305,0,620,0,0,0,620,53.524,43.62,52.491,0.0,31.943,"normal",true,0],[88,"22:00",1320,0,590,10,0,0,580,52.852,43.62,52.491,0.0,31.943,"normal",true,0],[89,"22:15",1335,0,370,0,0,0,370,52.332,43.62,52.491,0.0,31.943,"normal",true,0],[90,"22:30",1350,0,320,10,0,0,310,51.899,43.62,52.491,0.0,31.943,"normal",true,0],[91,"22:45",1365,0,280,0,0,0,280,51.488,43.62,52.491,0.0,31.943,"normal",true,0],[92,"23:00",1380,0,390,10,0,0,380,51.055,43.62,52.491,0.0,31.943,"normal",true,0],[93,"23:15",1395,0,400,10,0,0,390,50.621,43.62,52.491,0.0,31.943,"normal",true,0],[94,"23:30",1410,0,230,0,0,0,230,50.275,43.62,52.491,0.0,31.943,"normal",true,0],[95,"23:45",1425,0,230,0,0,0,230,49.972,43.62,52.491,0.0,31.943,"normal",true,0]]}
